{"causationid":"command-1","correlationid":"correlation-1","data":{"active":true,"count":2},"datacontenttype":"application/json","dataschema":"urn:example:schema:changed:1","id":"01JTESTMESSAGE00000000000000","profile":"titect-message/1","source":"urn:example:component","specversion":"1.0","subject":"aggregate/example","time":"2026-09-03T12:30:00.123Z","type":"example.changed.v1"}
